{
  "brief_hash": "16922d4b",
  "iteration": "001",
  "rubric_name": "writing:v2",
  "rubric_scores": {
    "scores": {
      "judgment": 4.3,
      "evidence": 4.5,
      "reader_fit": 4,
      "grounding": 4.6,
      "structure": 4.1,
      "sentence": 3.7,
      "originality": 4.1,
      "purpose_fit": 3.6
    },
    "weights": {
      "judgment": 0.18,
      "evidence": 0.15,
      "reader_fit": 0.15,
      "grounding": 0.12,
      "structure": 0.1,
      "sentence": 0.1,
      "originality": 0.1,
      "purpose_fit": 0.1
    },
    "weighted_total": 4.14
  },
  "axis_rationales": {
    "judgment": "판단 전환뿐 아니라 버린 선택지와 조건부 판단까지 본문에 포함되어 있어 강하지만, 일부 파기 판단은 핵심 흐름에 비해 열거로 붙는다.",
    "evidence": "18개 시나리오, 16/18, 2:2와 4:0, 132/277/117, 21개 테스트 같은 관측값이 주요 주장마다 붙어 있다.",
    "reader_fit": "처음 읽는 백엔드 평가자가 따라갈 배경은 대체로 제공되지만, 하네스와 게이트 논의가 길고 밀도가 높아 채용 판단용 글로는 부담이 있다.",
    "grounding": "수치와 사건은 거의 모두 brief의 재료에 근거하고 유보도 일부 유지하지만, 몇몇 표현은 원자료의 추론을 약간 단정적으로 압축한다.",
    "structure": "네 겹의 전환에서 사람의 자리와 성장 정의로 이어지는 배열이 분명하고 결론도 도입을 회수하지만, 중후반 조건부 판단 묶음이 다소 길게 늘어진다.",
    "sentence": "문장은 차분하고 명확하나 같은 구조의 요약 문장과 확인 문장이 반복되어 압축 가능한 대목이 여러 곳 남아 있다.",
    "originality": "‘판정석이 아니라 증인석’, ‘판정을 왼쪽으로 옮긴다’, ‘틀린 걸 모르는 속도’처럼 경험에서 나온 고유한 판단 문장이 뚜렷하다.",
    "purpose_fit": "필수 포함 요소는 모두 다루고 과장도 피하지만, 목표 분량 5500-7000자를 크게 넘는 초안이라 요청한 산출물 제약에는 완전히 맞지 않는다."
  },
  "calibration_note": "평균 3.0 기준으로 보정했다. 이 초안은 근거와 판단 과정이 강한 편이라 4점대가 가능하지만, 길이 초과와 반복 때문에 총점은 4.2선 아래로 둔다.",
  "evaluated_at": "2026-08-24T09:58:36+09:00",
  "model": "gpt-5.5",
  "metadata": {
    "prompt_version": "eval_system:v1",
    "source_files": [
      "16922d4b_input.json",
      "16922d4b_iter-001_draft.json"
    ],
    "token_usage": {
      "input_tokens": 52634,
      "cached_input_tokens": 2432,
      "output_tokens": 1109,
      "reasoning_output_tokens": 516
    }
  }
}
