{
  "brief_hash": "d264193d",
  "iteration": "004",
  "rubric_name": "writing:v2",
  "rubric_scores": {
    "scores": {
      "judgment": 4,
      "evidence": 4.4,
      "reader_fit": 4,
      "grounding": 4.8,
      "structure": 4.3,
      "sentence": 4.1,
      "originality": 4.2,
      "purpose_fit": 4.1
    },
    "weights": {
      "judgment": 0.18,
      "evidence": 0.15,
      "reader_fit": 0.15,
      "grounding": 0.12,
      "structure": 0.1,
      "sentence": 0.1,
      "originality": 0.1,
      "purpose_fit": 0.1
    },
    "weighted_total": 4.28
  },
  "axis_rationales": {
    "judgment": "네 겹의 판단 변화와 일부 버린 선택지, 제한 조건이 드러나지만 각 판단이 깨지는 조건은 원문 메모보다 축약되어 있다.",
    "evidence": "18개 중 16개, 277줄 대 132줄, 21개 초록불 같은 관측값이 주요 주장마다 붙어 있어 확인 가능한 근거가 강하다.",
    "reader_fit": "처음 읽는 개발자도 따라올 수 있게 용어와 실험을 풀어 쓰지만, 채용자가 쥐고 싶은 판단 근거라는 독자 문제는 후반부에서만 간접적으로 회수된다.",
    "grounding": "수치, 사례, 판단이 대부분 brief의 근거 자료와 일치하며 새 경험을 보태지 않는다.",
    "structure": "도입에서 네 겹을 예고하고 각 겹, 사람의 자리, 성장 정의로 이어져 결론이 도입을 잘 회수한다.",
    "sentence": "문장은 차분하고 밀도 있지만 ‘분명하다’류의 정리 문장과 유사한 판정 문장이 몇 차례 반복된다.",
    "originality": "초록불, 잣대, 판정석/증인석, 왼쪽으로 옮긴다는 판단이 개인 실험에서 나온 고유한 관점으로 읽힌다.",
    "purpose_fit": "톤과 필수 포함 사항은 대체로 충족하지만 목표 분량보다 길어 보이고 일부 세부가 압축되지 않아 회고의 집중도가 조금 떨어진다."
  },
  "calibration_note": "평균 3.0 기준으로 보정하면, 이 초안은 관측 기반 판단과 구조가 뚜렷해 4점대가 타당하지만, 독자 정렬과 판단의 깨짐 조건이 완전히 닫힌 수준은 아니어서 5점은 주지 않았다.",
  "evaluated_at": "2026-08-24T10:56:55+09:00",
  "model": "gpt-5.5",
  "metadata": {
    "prompt_version": "eval_system:v1",
    "source_files": [
      "d264193d_input.json",
      "d264193d_iter-004_draft.json"
    ],
    "token_usage": {
      "input_tokens": 49383,
      "cached_input_tokens": 21888,
      "output_tokens": 1066,
      "reasoning_output_tokens": 516
    }
  }
}
