{
  "brief_hash": "81ed33b8",
  "iteration": "002",
  "rubric_name": "writing:v2",
  "rubric_scores": {
    "scores": {
      "judgment": 4.4,
      "evidence": 4.3,
      "reader_fit": 4.0,
      "grounding": 4.6,
      "structure": 4.3,
      "sentence": 4.0,
      "originality": 4.1,
      "purpose_fit": 4.2
    },
    "weights": {
      "judgment": 0.18,
      "evidence": 0.15,
      "reader_fit": 0.15,
      "grounding": 0.12,
      "structure": 0.1,
      "sentence": 0.1,
      "originality": 0.1,
      "purpose_fit": 0.1
    },
    "weighted_total": 4.25
  },
  "axis_rationales": {
    "judgment": "단마다 버린 선택지와 남은 조건을 함께 제시하고, 마지막에 깨지는 조건까지 회수해 판단 과정이 뚜렷하다.",
    "evidence": "16/18, 4.165점, 4건/0건, 적용된 세 제안 등 주요 주장마다 실제 기록이 붙지만 콘텐츠 자동화 쪽 근거는 상대적으로 얇다.",
    "reader_fit": "처음 읽는 독자도 큰 흐름은 따라갈 수 있게 설명하지만 `refund.feature`, 계약 검사, 느린 루프 같은 내부어가 일부 압축되어 있다.",
    "grounding": "1인칭 판단, 수치, 사례가 대부분 brief의 재료와 정확히 대응하며 확신도도 대체로 유보되어 있다.",
    "structure": "1단부터 4단, 세로 차단, 가로 확장, 회고로 이어지는 배열이 선명하고 결론이 앞 논의를 잘 모은다.",
    "sentence": "문장은 차분하고 읽히지만 '넘긴 것/남은 것' 구조가 의도적으로 반복되며 일부 문단은 밀도가 조금 느슨하다.",
    "originality": "사다리, 잣대, 남은 일의 이동이라는 개인적 판단이 뚜렷하나 표현 자체는 brief의 개념을 비교적 충실히 정리하는 쪽에 가깝다.",
    "purpose_fit": "필수 포함 요소와 차분한 개발자 회고 톤은 잘 충족하지만 목표 분량 대비 다소 길어 보이고 내부 구조 설명 비중이 약간 크다."
  },
  "calibration_note": "평균 3.0을 기준으로 보정하면, 이 초안은 요구된 회고 구조와 근거 추적을 상당히 잘 수행한 편이라 다수 축에서 4점대가 정당하다.",
  "evaluated_at": "2026-08-24T14:43:59+09:00",
  "model": "gpt-5.5",
  "metadata": {
    "prompt_version": "eval_system:v1",
    "source_files": [
      "81ed33b8_input.json",
      "81ed33b8_iter-002_draft.json"
    ],
    "token_usage": {
      "input_tokens": 35027,
      "cached_input_tokens": 2432,
      "output_tokens": 1067,
      "reasoning_output_tokens": 516
    }
  }
}
