{
  "brief_hash": "2ffa3dc3",
  "iteration": "001",
  "rubric_name": "writing:v2",
  "rubric_scores": {
    "scores": {
      "judgment": 4.4,
      "evidence": 4.3,
      "reader_fit": 4.0,
      "grounding": 4.4,
      "structure": 4.0,
      "sentence": 3.7,
      "originality": 3.9,
      "purpose_fit": 3.5
    },
    "weights": {
      "judgment": 0.18,
      "evidence": 0.15,
      "reader_fit": 0.15,
      "grounding": 0.12,
      "structure": 0.1,
      "sentence": 0.1,
      "originality": 0.1,
      "purpose_fit": 0.1
    },
    "weighted_total": 4.05
  },
  "axis_rationales": {
    "judgment": "검토한 선택지, 버린 경로, 판단이 깨지는 조건이 대부분 본문에 들어가 있어 판단의 구조가 선명하다.",
    "evidence": "18개 시나리오, 16개 통과와 2개 실패, 4.31에서 4.06 하락 등 주요 주장에 실측 사례가 잘 붙어 있다.",
    "reader_fit": "처음 나오는 개념을 비교적 쉬운 말로 풀어 독자가 따라가기 좋지만, 중반 이후 장치 설명이 길어져 익숙하지 않은 독자에게 부담이 생긴다.",
    "grounding": "수치와 1인칭 판단은 대체로 입력 재료에 근거하나, 일부 ‘넘긴 뒤가 더 나았다’ 같은 평가는 재료의 유보보다 약간 단정적이다.",
    "structure": "한 칸씩 올라가는 배열과 마지막 회수는 분명하지만, 일부 절에 사례가 여러 개 겹쳐 절 내부 초점이 흐려진다.",
    "sentence": "문장은 차분하고 명료하나 같은 결론을 반복 확인하는 문장이 여럿 있어 분량 대비 밀도가 조금 낮다.",
    "originality": "‘넘긴 것과 남은 것’을 단계별로 추적하는 관점이 개인 경험에서 나오지만, 표현 자체는 비교적 설명적이고 안전한 편이다.",
    "purpose_fit": "필수 내용은 거의 모두 다루지만 목표 분량을 넘긴 것으로 보이고, ‘한 절에 사례 하나’ 제약을 2단과 3단에서 지키지 못한다."
  },
  "calibration_note": "평균 3.0을 기준으로 보정했다. 초안은 근거와 구조가 강하지만 길이와 절별 사례 제약 위반 때문에 5점대 평가는 제한했다.",
  "evaluated_at": "2026-08-24T15:12:40+09:00",
  "model": "gpt-5.5",
  "metadata": {
    "prompt_version": "eval_system:v1",
    "source_files": [
      "2ffa3dc3_input.json",
      "2ffa3dc3_iter-001_draft.json"
    ],
    "token_usage": {
      "input_tokens": 34168,
      "cached_input_tokens": 2432,
      "output_tokens": 1062,
      "reasoning_output_tokens": 516
    }
  }
}
